<?xml version="1.0" encoding="utf-8"?>

<sportesemenyekadatrendszere xmlns:xsi="http://www.w3.org/2001/XMLSchema-instance"
                             xsi:noNamespaceSchemaLocation="XMLSchemaK9IVJV.xsd">
    <jatekosok>
        <jatekos jatekos_ID="01" csapat_IDREF="06">
            <nev>Takács Mihály</nev>
            <szuletesiadatok>
                <szuletesihely>Budapest</szuletesihely>
                <szuletesiido>1988-08-08</szuletesiido>
            </szuletesiadatok>
            <allampolgarsag>magyar</allampolgarsag>
            <poszt>védő</poszt>
            <poszt>középpályás</poszt>
        </jatekos>
        <jatekos jatekos_ID="02" csapat_IDREF="02">
            <nev>Szekeres Róbert</nev>
            <szuletesiadatok>
                <szuletesihely>Budapest</szuletesihely>
                <szuletesiido>1988-09-30</szuletesiido>
            </szuletesiadatok>
            <allampolgarsag>magyar</allampolgarsag>
            <poszt>kapus</poszt>
            <poszt>támadó</poszt>
            <poszt>középpályás</poszt>
            <poszt>védő</poszt>
        </jatekos>
        <jatekos jatekos_ID="03" csapat_IDREF="01">
            <nev>Miksa Szilárd</nev>
            <szuletesiadatok>
                <szuletesihely>Debrecen</szuletesihely>
                <szuletesiido>1989-01-18</szuletesiido>
            </szuletesiadatok>
            <allampolgarsag>magyar</allampolgarsag>
            <poszt>kapus</poszt>
            <poszt>támadó</poszt>
            <poszt>középpályás</poszt>
            <poszt>védő</poszt>
        </jatekos>
        <jatekos jatekos_ID="04" csapat_IDREF="03">
            <nev>László Antal</nev>
            <szuletesiadatok>
                <szuletesihely>Markotabödöge</szuletesihely>
                <szuletesiido>1990-06-18</szuletesiido>
            </szuletesiadatok>
            <allampolgarsag>magyar</allampolgarsag>
            <poszt>védő</poszt>
            <poszt>középpályás</poszt>
        </jatekos>
        <jatekos jatekos_ID="05" csapat_IDREF="04">
            <nev>Egyed Zoltán</nev>
            <szuletesiadatok>
                <szuletesihely>Debrecen</szuletesihely>
                <szuletesiido>1990-11-19</szuletesiido>
            </szuletesiadatok>
            <allampolgarsag>magyar</allampolgarsag>
            <poszt>védő</poszt>
        </jatekos>
        <jatekos jatekos_ID="06" csapat_IDREF="05">
            <nev>Szalai Adrián</nev>
            <szuletesiadatok>
                <szuletesihely>Szeged</szuletesihely>
                <szuletesiido>1991-01-15</szuletesiido>
            </szuletesiadatok>
            <allampolgarsag>magyar</allampolgarsag>
            <poszt>védő</poszt>
            <poszt>középpályás</poszt>
            <poszt>kapus</poszt>
        </jatekos>
        <jatekos jatekos_ID="07" csapat_IDREF="01">
            <nev>Kapolcs Vilmos</nev>
            <szuletesiadatok>
                <szuletesihely>Budapest</szuletesihely>
                <szuletesiido>1991-02-26</szuletesiido>
            </szuletesiadatok>
            <allampolgarsag>magyar</allampolgarsag>
            <poszt>kapus</poszt>
        </jatekos>
        <jatekos jatekos_ID="08" csapat_IDREF="03">
            <nev>Apród Levente</nev>
            <szuletesiadatok>
                <szuletesihely>Debrecen</szuletesihely>
                <szuletesiido>1992-05-29</szuletesiido>
            </szuletesiadatok>
            <allampolgarsag>magyar</allampolgarsag>
            <poszt>kapus</poszt>
        </jatekos>
        <jatekos jatekos_ID="09" csapat_IDREF="06">
            <nev>Simon János</nev>
            <szuletesiadatok>
                <szuletesihely>Szeged</szuletesihely>
                <szuletesiido>1992-07-13</szuletesiido>
            </szuletesiadatok>
            <allampolgarsag>magyar</allampolgarsag>
            <poszt>kapus</poszt>
        </jatekos>
        <jatekos jatekos_ID="10" csapat_IDREF="02">
            <nev>Dobos Dezső</nev>
            <szuletesiadatok>
                <szuletesihely>Mikekarácsonyfa</szuletesihely>
                <szuletesiido>1992-08-26</szuletesiido>
            </szuletesiadatok>
            <allampolgarsag>magyar</allampolgarsag>
            <poszt>védő</poszt>
            <poszt>középpályás</poszt>
        </jatekos>
        <jatekos jatekos_ID="11" csapat_IDREF="05">
            <nev>Bakos György</nev>
            <szuletesiadatok>
                <szuletesihely>Budapest</szuletesihely>
                <szuletesiido>1993-06-25</szuletesiido>
            </szuletesiadatok>
            <allampolgarsag>magyar</allampolgarsag>
            <poszt>kapus</poszt>
        </jatekos>
        <jatekos jatekos_ID="12" csapat_IDREF="04">
            <nev>Pintér Attila</nev>
            <szuletesiadatok>
                <szuletesihely>Ásványráró</szuletesihely>
                <szuletesiido>1993-10-18</szuletesiido>
            </szuletesiadatok>
            <allampolgarsag>magyar</allampolgarsag>
            <poszt>kapus</poszt>
        </jatekos>
        <jatekos jatekos_ID="13" csapat_IDREF="05">
            <nev>Nemes Vilmos</nev>
            <szuletesiadatok>
                <szuletesihely>Kerkabarabás</szuletesihely>
                <szuletesiido>1993-12-13</szuletesiido>
            </szuletesiadatok>
            <allampolgarsag>magyar</allampolgarsag>
            <poszt>védő</poszt>
            <poszt>kapus</poszt>
        </jatekos>
        <jatekos jatekos_ID="14" csapat_IDREF="02">
            <nev>Kerekes Ákos</nev>
            <szuletesiadatok>
                <szuletesihely>Miskolc</szuletesihely>
                <szuletesiido>1994-05-08</szuletesiido>
            </szuletesiadatok>
            <allampolgarsag>magyar</allampolgarsag>
            <poszt>középpályás</poszt>
        </jatekos>
        <jatekos jatekos_ID="15" csapat_IDREF="01">
            <nev>Molnár Arnold</nev>
            <szuletesiadatok>
                <szuletesihely>Pécs</szuletesihely>
                <szuletesiido>1994-06-25</szuletesiido>
            </szuletesiadatok>
            <allampolgarsag>magyar</allampolgarsag>
            <poszt>védő</poszt>
            <poszt>középpályás</poszt>
            <poszt>kapus</poszt>
        </jatekos>
        <jatekos jatekos_ID="16" csapat_IDREF="03">
            <nev>Jónás Benedek</nev>
            <szuletesiadatok>
                <szuletesihely>Budapest</szuletesihely>
                <szuletesiido>1994-12-06</szuletesiido>
            </szuletesiadatok>
            <allampolgarsag>magyar</allampolgarsag>
            <poszt>középpályás</poszt>
        </jatekos>
        <jatekos jatekos_ID="17" csapat_IDREF="06">
            <nev>Hajdú Gyula</nev>
            <szuletesiadatok>
                <szuletesihely>Chernelházadamonya</szuletesihely>
                <szuletesiido>1995-12-31</szuletesiido>
            </szuletesiadatok>
            <allampolgarsag>magyar</allampolgarsag>
            <poszt>védő</poszt>
            <poszt>középpályás</poszt>
            <poszt>kapus</poszt>
            <poszt>támadó</poszt>
        </jatekos>
        <jatekos jatekos_ID="18" csapat_IDREF="04">
            <nev>Váradi Ádám</nev>
            <szuletesiadatok>
                <szuletesihely>Szeged</szuletesihely>
                <szuletesiido>1996-01-03</szuletesiido>
            </szuletesiadatok>
            <allampolgarsag>magyar</allampolgarsag>
            <poszt>kapus</poszt>
            <poszt>támadó</poszt>
            <poszt>középpályás</poszt>
        </jatekos>
        <jatekos jatekos_ID="19" csapat_IDREF="04">
            <nev>Orosz Miklós</nev>
            <szuletesiadatok>
                <szuletesihely>Miskolc</szuletesihely>
                <szuletesiido>1996-07-23</szuletesiido>
            </szuletesiadatok>
            <allampolgarsag>magyar</allampolgarsag>
            <poszt>kapus</poszt>
            <poszt>középpályás</poszt>
            <poszt>támadó</poszt>
        </jatekos>
        <jatekos jatekos_ID="20" csapat_IDREF="05">
            <nev>Budai Marcell</nev>
            <szuletesiadatok>
                <szuletesihely>Pókaszepetk</szuletesihely>
                <szuletesiido>1997-04-12</szuletesiido>
            </szuletesiadatok>
            <allampolgarsag>magyar</allampolgarsag>
            <poszt>támadó</poszt>
        </jatekos>
        <jatekos jatekos_ID="21" csapat_IDREF="03">
            <nev>Csonka Antal</nev>
            <szuletesiadatok>
                <szuletesihely>Győr</szuletesihely>
                <szuletesiido>1997-07-08</szuletesiido>
            </szuletesiadatok>
            <allampolgarsag>magyar</allampolgarsag>
            <poszt>középpályás</poszt>
        </jatekos>
        <jatekos jatekos_ID="22" csapat_IDREF="02">
            <nev>Halász Károly</nev>
            <szuletesiadatok>
                <szuletesihely>Kiskundorozsma</szuletesihely>
                <szuletesiido>1998-06-07</szuletesiido>
            </szuletesiadatok>
            <allampolgarsag>magyar</allampolgarsag>
            <poszt>védő</poszt>
            <poszt>középpályás</poszt>
            <poszt>kapus</poszt>
            <poszt>támadó</poszt>
        </jatekos>
        <jatekos jatekos_ID="23" csapat_IDREF="01">
            <nev>Vincze Henrik</nev>
            <szuletesiadatok>
                <szuletesihely>Debrecen</szuletesihely>
                <szuletesiido>1998-09-01</szuletesiido>
            </szuletesiadatok>
            <allampolgarsag>magyar</allampolgarsag>
            <poszt>védő</poszt>
            <poszt>középpályás</poszt>
            <poszt>kapus</poszt>
        </jatekos>
        <jatekos jatekos_ID="24" csapat_IDREF="03">
            <nev>Pásztor Jakab</nev>
            <szuletesiadatok>